habit_label,evidence,counsel,full_text
Financial Flow,"[Critical]; Evidence: Total income is 0, while total expenses are 1472",Prioritize tracking all income sources to understand your financial inflows,"- Financial Flow: [Critical]; Evidence: Total income is 0, while total expenses are 1472; Counsel: Prioritize tracking all income sources to understand your financial inflows."
Core Spending,"[High]; Evidence: ""Financial - High Confidence"" covers 1072 of 1472 total expenses",Analyze these 13 transactions for potential savings or better budgeting,"- Core Spending: [High]; Evidence: ""Financial - High Confidence"" covers 1072 of 1472 total expenses; Counsel: Analyze these 13 transactions for potential savings or better budgeting."
Activity Lapse,"[Noticeable]; Evidence: No transactions, income, or expenses in the last 30 days",Verify that all recent financial activity is being fully tracked,"- Activity Lapse: [Noticeable]; Evidence: No transactions, income, or expenses in the last 30 days; Counsel: Verify that all recent financial activity is being fully tracked."
Expense Focus,"[Sole]; Evidence: All 15 recorded transactions are expenses, totaling 1472",Start tracking income and any non-expense transactions to gain a holistic view,"- Expense Focus: [Sole]; Evidence: All 15 recorded transactions are expenses, totaling 1472; Counsel: Start tracking income and any non-expense transactions to gain a holistic view."
[Universal],"All 15 transactions are categorized as ""necessity""",Re-evaluate spending to differentiate true necessities from potential discretionary items,"- Necessity Label: [Universal]; Evidence: All 15 transactions are categorized as ""necessity""; Counsel: Re-evaluate spending to differentiate true necessities from potential discretionary items."
Recharge Impact,[Significant]; Evidence: The largest single expense is a 666 Vi recharge,Explore different plans or usage patterns to optimize recurring telecom costs,- Recharge Impact: [Significant]; Evidence: The largest single expense is a 666 Vi recharge; Counsel: Explore different plans or usage patterns to optimize recurring telecom costs.
Pocket Money Flow,"[Ambiguous]; Evidence: 300 is listed as ""Pocket Money"" expense",Clarify if this represents an expense or a miscategorized income event,"- Pocket Money Flow: [Ambiguous]; Evidence: 300 is listed as ""Pocket Money"" expense; Counsel: Clarify if this represents an expense or a miscategorized income event."
